{
  "schema_version": "1.0.0",
  "experiment_id": "u02-s1-ab-diversity-v9-20261014",
  "dataset": "pilot",
  "condition_ids": ["A", "B"],
  "scenario_ids": ["S1"],
  "replicates": [1, 2, 3],
  "discovery_reports": {
    "S1": {
      "1": "results/zap/zap-discovery-low-20261011-180846.normalized.json"
    }
  },
  "seclists_source_root": null
}
